<?xml version="1.0" encoding="ISO-8859-1"?><!DOCTYPE Class SYSTEM "dtd/dbkclass.dtd">
<Class name="aio_type" numAttributes="39" numInstances="0" numPeriod_MT="0" numPeriod_ST="0" period_MT="0" period_ST="0">
<AttributeDescription attrType="STATIC" name="initCondTable" replicated="0">
<StructVector numElementsList="8" numElementsStruct="2">
<StructFieldDescription name="condInfo">
<Scalar size="31" valueType="CHARN"/>
</StructFieldDescription>
<StructFieldDescription name="condVal">
<Scalar size="1" valueType="BOOLEAN"/>
</StructFieldDescription>
</StructVector>
<StructVectorDefaultValue numElementsList="8">
<StructFieldDefaultValue>
<ScalarDefaultValue defaultValue=""/>
<ScalarDefaultValue defaultValue="false"/>
</StructFieldDefaultValue>
<StructFieldDefaultValue>
<ScalarDefaultValue defaultValue=""/>
<ScalarDefaultValue defaultValue="false"/>
</StructFieldDefaultValue>
<StructFieldDefaultValue>
<ScalarDefaultValue defaultValue=""/>
<ScalarDefaultValue defaultValue="false"/>
</StructFieldDefaultValue>
<StructFieldDefaultValue>
<ScalarDefaultValue defaultValue=""/>
<ScalarDefaultValue defaultValue="false"/>
</StructFieldDefaultValue>
<StructFieldDefaultValue>
<ScalarDefaultValue defaultValue=""/>
<ScalarDefaultValue defaultValue="false"/>
</StructFieldDefaultValue>
<StructFieldDefaultValue>
<ScalarDefaultValue defaultValue=""/>
<ScalarDefaultValue defaultValue="false"/>
</StructFieldDefaultValue>
<StructFieldDefaultValue>
<ScalarDefaultValue defaultValue=""/>
<ScalarDefaultValue defaultValue="false"/>
</StructFieldDefaultValue>
<StructFieldDefaultValue>
<ScalarDefaultValue defaultValue=""/>
<ScalarDefaultValue defaultValue="false"/>
</StructFieldDefaultValue>
</StructVectorDefaultValue>
</AttributeDescription>
<AttributeDescription attrType="STATIC" name="retCondTable" replicated="0">
<StructVector numElementsList="8" numElementsStruct="2">
<StructFieldDescription name="condInfo">
<Scalar size="31" valueType="CHARN"/>
</StructFieldDescription>
<StructFieldDescription name="condVal">
<Scalar size="1" valueType="BOOLEAN"/>
</StructFieldDescription>
</StructVector>
<StructVectorDefaultValue numElementsList="8">
<StructFieldDefaultValue>
<ScalarDefaultValue defaultValue=""/>
<ScalarDefaultValue defaultValue="false"/>
</StructFieldDefaultValue>
<StructFieldDefaultValue>
<ScalarDefaultValue defaultValue=""/>
<ScalarDefaultValue defaultValue="false"/>
</StructFieldDefaultValue>
<StructFieldDefaultValue>
<ScalarDefaultValue defaultValue=""/>
<ScalarDefaultValue defaultValue="false"/>
</StructFieldDefaultValue>
<StructFieldDefaultValue>
<ScalarDefaultValue defaultValue=""/>
<ScalarDefaultValue defaultValue="false"/>
</StructFieldDefaultValue>
<StructFieldDefaultValue>
<ScalarDefaultValue defaultValue=""/>
<ScalarDefaultValue defaultValue="false"/>
</StructFieldDefaultValue>
<StructFieldDefaultValue>
<ScalarDefaultValue defaultValue=""/>
<ScalarDefaultValue defaultValue="false"/>
</StructFieldDefaultValue>
<StructFieldDefaultValue>
<ScalarDefaultValue defaultValue=""/>
<ScalarDefaultValue defaultValue="false"/>
</StructFieldDefaultValue>
<StructFieldDefaultValue>
<ScalarDefaultValue defaultValue=""/>
<ScalarDefaultValue defaultValue="false"/>
</StructFieldDefaultValue>
</StructVectorDefaultValue>
</AttributeDescription>
<AttributeDescription attrType="STATIC" name="UNIVNAME" replicated="0">
<Scalar size="65" valueType="CHARN"/>
<ScalarDefaultValue defaultValue=""/>
</AttributeDescription>
<AttributeDescription attrType="STATIC" name="class_id" replicated="0">
<Scalar size="21" valueType="CHARN"/>
<ScalarDefaultValue defaultValue="108"/>
</AttributeDescription>
<AttributeDescription attrType="STATIC" name="computedMessage" replicated="0">
<Scalar size="257" valueType="CHARN"/>
<ScalarDefaultValue defaultValue=""/>
</AttributeDescription>
<AttributeDescription attrType="STATIC" name="execStatus" replicated="0">
<Scalar size="4" valueType="INT32"/>
<ScalarDefaultValue defaultValue="0"/>
</AttributeDescription>
<AttributeDescription attrType="STATIC" name="hmiOrder" replicated="0">
<Scalar size="4" valueType="INT32"/>
<ScalarDefaultValue defaultValue="0"/>
</AttributeDescription>
<AttributeDescription attrType="STATIC" name="initCond1" replicated="0">
<Scalar size="1" valueType="BOOLEAN"/>
<ScalarDefaultValue defaultValue="1"/>
</AttributeDescription>
<AttributeDescription attrType="STATIC" name="initCond2" replicated="0">
<Scalar size="1" valueType="BOOLEAN"/>
<ScalarDefaultValue defaultValue="1"/>
</AttributeDescription>
<AttributeDescription attrType="STATIC" name="initCond3" replicated="0">
<Scalar size="1" valueType="BOOLEAN"/>
<ScalarDefaultValue defaultValue="1"/>
</AttributeDescription>
<AttributeDescription attrType="STATIC" name="initCond4" replicated="0">
<Scalar size="1" valueType="BOOLEAN"/>
<ScalarDefaultValue defaultValue="1"/>
</AttributeDescription>
<AttributeDescription attrType="STATIC" name="initCond5" replicated="0">
<Scalar size="1" valueType="BOOLEAN"/>
<ScalarDefaultValue defaultValue="1"/>
</AttributeDescription>
<AttributeDescription attrType="STATIC" name="initCond6" replicated="0">
<Scalar size="1" valueType="BOOLEAN"/>
<ScalarDefaultValue defaultValue="1"/>
</AttributeDescription>
<AttributeDescription attrType="STATIC" name="initCond7" replicated="0">
<Scalar size="1" valueType="BOOLEAN"/>
<ScalarDefaultValue defaultValue="1"/>
</AttributeDescription>
<AttributeDescription attrType="STATIC" name="initCond8" replicated="0">
<Scalar size="1" valueType="BOOLEAN"/>
<ScalarDefaultValue defaultValue="1"/>
</AttributeDescription>
<AttributeDescription attrType="STATIC" name="initCondGL" replicated="0">
<Scalar size="1" valueType="BOOLEAN"/>
<ScalarDefaultValue defaultValue="false"/>
</AttributeDescription>
<AttributeDescription attrType="STATIC" name="initCondTO" replicated="0">
<Scalar size="4" valueType="INT32"/>
<ScalarDefaultValue defaultValue="0"/>
</AttributeDescription>
<AttributeDescription attrType="STATIC" name="label" replicated="0">
<Scalar size="65" valueType="CHARN"/>
<ScalarDefaultValue defaultValue=""/>
</AttributeDescription>
<AttributeDescription attrType="STATIC" name="nom_instance" replicated="0">
<Scalar size="51" valueType="CHARN"/>
<ScalarDefaultValue defaultValue=""/>
</AttributeDescription>
<AttributeDescription attrType="STATIC" name="opDate" replicated="0">
<Scalar size="8" valueType="DATE"/>
<ScalarDefaultValue defaultValue="01/01/2000 00:00:00.000"/>
</AttributeDescription>
<AttributeDescription attrType="STATIC" name="opSource" replicated="0">
<Scalar size="9" valueType="CHARN"/>
<ScalarDefaultValue defaultValue=""/>
</AttributeDescription>
<AttributeDescription attrType="STATIC" name="previousStatus" replicated="0">
<Scalar size="4" valueType="INT32"/>
<ScalarDefaultValue defaultValue="0"/>
</AttributeDescription>
<AttributeDescription attrType="STATIC" name="previousValue" replicated="0">
<Scalar size="4" valueType="FLOAT"/>
<ScalarDefaultValue defaultValue="0.0"/>
</AttributeDescription>
<AttributeDescription attrType="STATIC" name="returnCond1" replicated="0">
<Scalar size="1" valueType="BOOLEAN"/>
<ScalarDefaultValue defaultValue="1"/>
</AttributeDescription>
<AttributeDescription attrType="STATIC" name="returnCond2" replicated="0">
<Scalar size="1" valueType="BOOLEAN"/>
<ScalarDefaultValue defaultValue="1"/>
</AttributeDescription>
<AttributeDescription attrType="STATIC" name="returnCond3" replicated="0">
<Scalar size="1" valueType="BOOLEAN"/>
<ScalarDefaultValue defaultValue="1"/>
</AttributeDescription>
<AttributeDescription attrType="STATIC" name="returnCond4" replicated="0">
<Scalar size="1" valueType="BOOLEAN"/>
<ScalarDefaultValue defaultValue="1"/>
</AttributeDescription>
<AttributeDescription attrType="STATIC" name="returnCond5" replicated="0">
<Scalar size="1" valueType="BOOLEAN"/>
<ScalarDefaultValue defaultValue="1"/>
</AttributeDescription>
<AttributeDescription attrType="STATIC" name="returnCond6" replicated="0">
<Scalar size="1" valueType="BOOLEAN"/>
<ScalarDefaultValue defaultValue="1"/>
</AttributeDescription>
<AttributeDescription attrType="STATIC" name="returnCond7" replicated="0">
<Scalar size="1" valueType="BOOLEAN"/>
<ScalarDefaultValue defaultValue="1"/>
</AttributeDescription>
<AttributeDescription attrType="STATIC" name="returnCond8" replicated="0">
<Scalar size="1" valueType="BOOLEAN"/>
<ScalarDefaultValue defaultValue="1"/>
</AttributeDescription>
<AttributeDescription attrType="STATIC" name="returnCondGL" replicated="0">
<Scalar size="1" valueType="BOOLEAN"/>
<ScalarDefaultValue defaultValue="false"/>
</AttributeDescription>
<AttributeDescription attrType="STATIC" name="returnCondTO" replicated="0">
<Scalar size="4" valueType="INT32"/>
<ScalarDefaultValue defaultValue="0"/>
</AttributeDescription>
<AttributeDescription attrType="STATIC" name="source" replicated="0">
<Scalar size="9" valueType="CHARN"/>
<ScalarDefaultValue defaultValue=""/>
</AttributeDescription>
<AttributeDescription attrType="STATIC" name="status" replicated="0">
<Scalar size="4" valueType="INT32"/>
<ScalarDefaultValue defaultValue="1"/>
</AttributeDescription>
<AttributeDescription attrType="STATIC" name="unit" replicated="0">
<Scalar size="21" valueType="CHARN"/>
<ScalarDefaultValue defaultValue=""/>
</AttributeDescription>
<AttributeDescription attrType="STATIC" name="value" replicated="0">
<Scalar size="4" valueType="FLOAT"/>
<ScalarDefaultValue defaultValue="0.0"/>
</AttributeDescription>
<AttributeDescription attrType="STATIC" name="valueLimits" replicated="0">
<Vector numElements="2">
<Scalar size="4" valueType="FLOAT"/>
</Vector>
<VectorDefaultValue>
<ScalarDefaultValue defaultValue="0.0"/>
<ScalarDefaultValue defaultValue="0.0"/>
</VectorDefaultValue>
</AttributeDescription>
<AttributeDescription attrType="STATIC" name="veCoord" replicated="0">
<Scalar size="81" valueType="CHARN"/>
<ScalarDefaultValue defaultValue=""/>
</AttributeDescription>
</Class>