<?xml version="1.0" encoding="ISO-8859-1"?><!DOCTYPE Class SYSTEM "dtd/dbkclass.dtd">
<Class name="ScadaSoft" numAttributes="5" numInstances="1" numPeriod_MT="0" numPeriod_ST="0" period_MT="0" period_ST="0">
<AttributeDescription attrType="STATIC" name="UNIVNAME" replicated="0">
<Scalar size="65" valueType="CHARN"/>
<ScalarDefaultValue defaultValue=""/>
</AttributeDescription>
<AttributeDescription attrType="STATIC" name="dbvDate" replicated="0">
<Scalar size="8" valueType="DATE"/>
<ScalarDefaultValue defaultValue="01/01/2000 00:00:00.000"/>
</AttributeDescription>
<AttributeDescription attrType="STATIC" name="dbvName" replicated="0">
<Scalar size="65" valueType="CHARN"/>
<ScalarDefaultValue defaultValue=""/>
</AttributeDescription>
<AttributeDescription attrType="STATIC" name="dpcTrigger" replicated="0">
<Scalar size="4" valueType="INT32"/>
<ScalarDefaultValue defaultValue="0"/>
</AttributeDescription>
<AttributeDescription attrType="STATIC" name="nom_instance" replicated="0">
<Scalar size="51" valueType="CHARN"/>
<ScalarDefaultValue defaultValue=""/>
</AttributeDescription>
</Class>