<?xml version="1.0" encoding="ISO-8859-1"?><!DOCTYPE Class SYSTEM "dtd/dbkclass.dtd">
<Class name="LstTag14" numAttributes="4" numInstances="0" numPeriod_MT="" numPeriod_ST="" period_MT="" period_ST="">
<AttributeDescription attrType="STATIC" name="UNIVNAME" replicated="0">
<Scalar size="65" valueType="CHARN"/>
<ScalarDefaultValue defaultValue=""/>
</AttributeDescription>
<AttributeDescription attrType="STATIC" name="nom_instance" replicated="0">
<Scalar size="51" valueType="CHARN"/>
<ScalarDefaultValue defaultValue=""/>
</AttributeDescription>
<AttributeDescription attrType="STATIC" name="parentID" replicated="0">
<Scalar size="65" valueType="CHARN"/>
<ScalarDefaultValue defaultValue=""/>
</AttributeDescription>
<AttributeDescription attrType="STATIC" name="type" replicated="0">
<Scalar size="65" valueType="CHARN"/>
<ScalarDefaultValue defaultValue=""/>
</AttributeDescription>
</Class>