<?xml version="1.0" encoding="ISO-8859-1"?><!DOCTYPE Class SYSTEM "dtd/dbkclass.dtd">
<Class name="clScsAlarm" numAttributes="4" numInstances="1" numPeriod_MT="0" numPeriod_ST="0" period_MT="0" period_ST="0">
<AttributeDescription attrType="STATIC" name="format" replicated="0">
<StructVector numElementsList="50" numElementsStruct="3">
<StructFieldDescription name="dataDisplay">
<Scalar size="257" valueType="CHARN"/>
</StructFieldDescription>
<StructFieldDescription name="dataDispo">
<Scalar size="257" valueType="CHARN"/>
</StructFieldDescription>
<StructFieldDescription name="dataType">
<Scalar size="257" valueType="CHARN"/>
</StructFieldDescription>
</StructVector>
<StructVectorDefaultValue numElementsList="50">
<StructFieldDefaultValue>
<ScalarDefaultValue defaultValue=""/>
<ScalarDefaultValue defaultValue=""/>
<ScalarDefaultValue defaultValue=""/>
</StructFieldDefaultValue>
<StructFieldDefaultValue>
<ScalarDefaultValue defaultValue=""/>
<ScalarDefaultValue defaultValue=""/>
<ScalarDefaultValue defaultValue=""/>
</StructFieldDefaultValue>
<StructFieldDefaultValue>
<ScalarDefaultValue defaultValue=""/>
<ScalarDefaultValue defaultValue=""/>
<ScalarDefaultValue defaultValue=""/>
</StructFieldDefaultValue>
<StructFieldDefaultValue>
<ScalarDefaultValue defaultValue=""/>
<ScalarDefaultValue defaultValue=""/>
<ScalarDefaultValue defaultValue=""/>
</StructFieldDefaultValue>
<StructFieldDefaultValue>
<ScalarDefaultValue defaultValue=""/>
<ScalarDefaultValue defaultValue=""/>
<ScalarDefaultValue defaultValue=""/>
</StructFieldDefaultValue>
<StructFieldDefaultValue>
<ScalarDefaultValue defaultValue=""/>
<ScalarDefaultValue defaultValue=""/>
<ScalarDefaultValue defaultValue=""/>
</StructFieldDefaultValue>
<StructFieldDefaultValue>
<ScalarDefaultValue defaultValue=""/>
<ScalarDefaultValue defaultValue=""/>
<ScalarDefaultValue defaultValue=""/>
</StructFieldDefaultValue>
<StructFieldDefaultValue>
<ScalarDefaultValue defaultValue=""/>
<ScalarDefaultValue defaultValue=""/>
<ScalarDefaultValue defaultValue=""/>
</StructFieldDefaultValue>
<StructFieldDefaultValue>
<ScalarDefaultValue defaultValue=""/>
<ScalarDefaultValue defaultValue=""/>
<ScalarDefaultValue defaultValue=""/>
</StructFieldDefaultValue>
<StructFieldDefaultValue>
<ScalarDefaultValue defaultValue=""/>
<ScalarDefaultValue defaultValue=""/>
<ScalarDefaultValue defaultValue=""/>
</StructFieldDefaultValue>
<StructFieldDefaultValue>
<ScalarDefaultValue defaultValue=""/>
<ScalarDefaultValue defaultValue=""/>
<ScalarDefaultValue defaultValue=""/>
</StructFieldDefaultValue>
<StructFieldDefaultValue>
<ScalarDefaultValue defaultValue=""/>
<ScalarDefaultValue defaultValue=""/>
<ScalarDefaultValue defaultValue=""/>
</StructFieldDefaultValue>
<StructFieldDefaultValue>
<ScalarDefaultValue defaultValue=""/>
<ScalarDefaultValue defaultValue=""/>
<ScalarDefaultValue defaultValue=""/>
</StructFieldDefaultValue>
<StructFieldDefaultValue>
<ScalarDefaultValue defaultValue=""/>
<ScalarDefaultValue defaultValue=""/>
<ScalarDefaultValue defaultValue=""/>
</StructFieldDefaultValue>
<StructFieldDefaultValue>
<ScalarDefaultValue defaultValue=""/>
<ScalarDefaultValue defaultValue=""/>
<ScalarDefaultValue defaultValue=""/>
</StructFieldDefaultValue>
<StructFieldDefaultValue>
<ScalarDefaultValue defaultValue=""/>
<ScalarDefaultValue defaultValue=""/>
<ScalarDefaultValue defaultValue=""/>
</StructFieldDefaultValue>
<StructFieldDefaultValue>
<ScalarDefaultValue defaultValue=""/>
<ScalarDefaultValue defaultValue=""/>
<ScalarDefaultValue defaultValue=""/>
</StructFieldDefaultValue>
<StructFieldDefaultValue>
<ScalarDefaultValue defaultValue=""/>
<ScalarDefaultValue defaultValue=""/>
<ScalarDefaultValue defaultValue=""/>
</StructFieldDefaultValue>
<StructFieldDefaultValue>
<ScalarDefaultValue defaultValue=""/>
<ScalarDefaultValue defaultValue=""/>
<ScalarDefaultValue defaultValue=""/>
</StructFieldDefaultValue>
<StructFieldDefaultValue>
<ScalarDefaultValue defaultValue=""/>
<ScalarDefaultValue defaultValue=""/>
<ScalarDefaultValue defaultValue=""/>
</StructFieldDefaultValue>
<StructFieldDefaultValue>
<ScalarDefaultValue defaultValue=""/>
<ScalarDefaultValue defaultValue=""/>
<ScalarDefaultValue defaultValue=""/>
</StructFieldDefaultValue>
<StructFieldDefaultValue>
<ScalarDefaultValue defaultValue=""/>
<ScalarDefaultValue defaultValue=""/>
<ScalarDefaultValue defaultValue=""/>
</StructFieldDefaultValue>
<StructFieldDefaultValue>
<ScalarDefaultValue defaultValue=""/>
<ScalarDefaultValue defaultValue=""/>
<ScalarDefaultValue defaultValue=""/>
</StructFieldDefaultValue>
<StructFieldDefaultValue>
<ScalarDefaultValue defaultValue=""/>
<ScalarDefaultValue defaultValue=""/>
<ScalarDefaultValue defaultValue=""/>
</StructFieldDefaultValue>
<StructFieldDefaultValue>
<ScalarDefaultValue defaultValue=""/>
<ScalarDefaultValue defaultValue=""/>
<ScalarDefaultValue defaultValue=""/>
</StructFieldDefaultValue>
<StructFieldDefaultValue>
<ScalarDefaultValue defaultValue=""/>
<ScalarDefaultValue defaultValue=""/>
<ScalarDefaultValue defaultValue=""/>
</StructFieldDefaultValue>
<StructFieldDefaultValue>
<ScalarDefaultValue defaultValue=""/>
<ScalarDefaultValue defaultValue=""/>
<ScalarDefaultValue defaultValue=""/>
</StructFieldDefaultValue>
<StructFieldDefaultValue>
<ScalarDefaultValue defaultValue=""/>
<ScalarDefaultValue defaultValue=""/>
<ScalarDefaultValue defaultValue=""/>
</StructFieldDefaultValue>
<StructFieldDefaultValue>
<ScalarDefaultValue defaultValue=""/>
<ScalarDefaultValue defaultValue=""/>
<ScalarDefaultValue defaultValue=""/>
</StructFieldDefaultValue>
<StructFieldDefaultValue>
<ScalarDefaultValue defaultValue=""/>
<ScalarDefaultValue defaultValue=""/>
<ScalarDefaultValue defaultValue=""/>
</StructFieldDefaultValue>
<StructFieldDefaultValue>
<ScalarDefaultValue defaultValue=""/>
<ScalarDefaultValue defaultValue=""/>
<ScalarDefaultValue defaultValue=""/>
</StructFieldDefaultValue>
<StructFieldDefaultValue>
<ScalarDefaultValue defaultValue=""/>
<ScalarDefaultValue defaultValue=""/>
<ScalarDefaultValue defaultValue=""/>
</StructFieldDefaultValue>
<StructFieldDefaultValue>
<ScalarDefaultValue defaultValue=""/>
<ScalarDefaultValue defaultValue=""/>
<ScalarDefaultValue defaultValue=""/>
</StructFieldDefaultValue>
<StructFieldDefaultValue>
<ScalarDefaultValue defaultValue=""/>
<ScalarDefaultValue defaultValue=""/>
<ScalarDefaultValue defaultValue=""/>
</StructFieldDefaultValue>
<StructFieldDefaultValue>
<ScalarDefaultValue defaultValue=""/>
<ScalarDefaultValue defaultValue=""/>
<ScalarDefaultValue defaultValue=""/>
</StructFieldDefaultValue>
<StructFieldDefaultValue>
<ScalarDefaultValue defaultValue=""/>
<ScalarDefaultValue defaultValue=""/>
<ScalarDefaultValue defaultValue=""/>
</StructFieldDefaultValue>
<StructFieldDefaultValue>
<ScalarDefaultValue defaultValue=""/>
<ScalarDefaultValue defaultValue=""/>
<ScalarDefaultValue defaultValue=""/>
</StructFieldDefaultValue>
<StructFieldDefaultValue>
<ScalarDefaultValue defaultValue=""/>
<ScalarDefaultValue defaultValue=""/>
<ScalarDefaultValue defaultValue=""/>
</StructFieldDefaultValue>
<StructFieldDefaultValue>
<ScalarDefaultValue defaultValue=""/>
<ScalarDefaultValue defaultValue=""/>
<ScalarDefaultValue defaultValue=""/>
</StructFieldDefaultValue>
<StructFieldDefaultValue>
<ScalarDefaultValue defaultValue=""/>
<ScalarDefaultValue defaultValue=""/>
<ScalarDefaultValue defaultValue=""/>
</StructFieldDefaultValue>
<StructFieldDefaultValue>
<ScalarDefaultValue defaultValue=""/>
<ScalarDefaultValue defaultValue=""/>
<ScalarDefaultValue defaultValue=""/>
</StructFieldDefaultValue>
<StructFieldDefaultValue>
<ScalarDefaultValue defaultValue=""/>
<ScalarDefaultValue defaultValue=""/>
<ScalarDefaultValue defaultValue=""/>
</StructFieldDefaultValue>
<StructFieldDefaultValue>
<ScalarDefaultValue defaultValue=""/>
<ScalarDefaultValue defaultValue=""/>
<ScalarDefaultValue defaultValue=""/>
</StructFieldDefaultValue>
<StructFieldDefaultValue>
<ScalarDefaultValue defaultValue=""/>
<ScalarDefaultValue defaultValue=""/>
<ScalarDefaultValue defaultValue=""/>
</StructFieldDefaultValue>
<StructFieldDefaultValue>
<ScalarDefaultValue defaultValue=""/>
<ScalarDefaultValue defaultValue=""/>
<ScalarDefaultValue defaultValue=""/>
</StructFieldDefaultValue>
<StructFieldDefaultValue>
<ScalarDefaultValue defaultValue=""/>
<ScalarDefaultValue defaultValue=""/>
<ScalarDefaultValue defaultValue=""/>
</StructFieldDefaultValue>
<StructFieldDefaultValue>
<ScalarDefaultValue defaultValue=""/>
<ScalarDefaultValue defaultValue=""/>
<ScalarDefaultValue defaultValue=""/>
</StructFieldDefaultValue>
<StructFieldDefaultValue>
<ScalarDefaultValue defaultValue=""/>
<ScalarDefaultValue defaultValue=""/>
<ScalarDefaultValue defaultValue=""/>
</StructFieldDefaultValue>
<StructFieldDefaultValue>
<ScalarDefaultValue defaultValue=""/>
<ScalarDefaultValue defaultValue=""/>
<ScalarDefaultValue defaultValue=""/>
</StructFieldDefaultValue>
<StructFieldDefaultValue>
<ScalarDefaultValue defaultValue=""/>
<ScalarDefaultValue defaultValue=""/>
<ScalarDefaultValue defaultValue=""/>
</StructFieldDefaultValue>
</StructVectorDefaultValue>
</AttributeDescription>
<AttributeDescription attrType="STATIC" name="UNIVNAME" replicated="0">
<Scalar size="65" valueType="CHARN"/>
<ScalarDefaultValue defaultValue=""/>
</AttributeDescription>
<AttributeDescription attrType="STATIC" name="nom_instance" replicated="0">
<Scalar size="51" valueType="CHARN"/>
<ScalarDefaultValue defaultValue=""/>
</AttributeDescription>
<AttributeDescription attrType="STATIC" name="resetSynthesis" replicated="0">
<Scalar size="4" valueType="INT32"/>
<ScalarDefaultValue defaultValue="0"/>
</AttributeDescription>
</Class>