<?xml version="1.0" encoding="ISO-8859-1"?><!DOCTYPE Class SYSTEM "dtd/dbkclass.dtd">
<Class name="cmb_type" numAttributes="5" numInstances="0" numPeriod_MT="" numPeriod_ST="" period_MT="" period_ST="">
<AttributeDescription attrType="STATIC" name="UNIVNAME" replicated="0">
<Scalar size="65" valueType="CHARN"/>
<ScalarDefaultValue defaultValue=""/>
</AttributeDescription>
<AttributeDescription attrType="STATIC" name="nom_instance" replicated="0">
<Scalar size="51" valueType="CHARN"/>
<ScalarDefaultValue defaultValue=""/>
</AttributeDescription>
<AttributeDescription attrType="STATIC" name="Trigger1" replicated="0">
<Scalar size="4" valueType="INT32"/>
<ScalarDefaultValue defaultValue="0"/>
</AttributeDescription>
<AttributeDescription attrType="STATIC" name="Trigger2" replicated="0">
<Scalar size="4" valueType="INT32"/>
<ScalarDefaultValue defaultValue="0"/>
</AttributeDescription>
<AttributeDescription attrType="STATIC" name="combinedStatus" replicated="0">
<Scalar size="4" valueType="INT32"/>
<ScalarDefaultValue defaultValue="0"/>
</AttributeDescription>
</Class>