<?xml version="1.0" encoding="ISO-8859-1"?><!DOCTYPE Class SYSTEM "dtd/dbkclass.dtd">
<Class name="basicNode" numAttributes="9" numInstances="66" numPeriod_MT="" numPeriod_ST="" period_MT="" period_ST="">
<AttributeDescription attrType="STATIC" name="UNIVNAME" replicated="0">
<Scalar size="65" valueType="CHARN"/>
<ScalarDefaultValue defaultValue=""/>
</AttributeDescription>
<AttributeDescription attrType="STATIC" name="alarmSynthesis" replicated="0">
<Vector numElements="4">
<Scalar size="4" valueType="INT32"/>
</Vector>
<VectorDefaultValue>
<ScalarDefaultValue defaultValue="0"/>
<ScalarDefaultValue defaultValue="0"/>
<ScalarDefaultValue defaultValue="0"/>
<ScalarDefaultValue defaultValue="0"/>
</VectorDefaultValue>
</AttributeDescription>
<AttributeDescription attrType="STATIC" name="functionalCat" replicated="0">
<Scalar size="4" valueType="INT32"/>
<ScalarDefaultValue defaultValue="0"/>
</AttributeDescription>
<AttributeDescription attrType="STATIC" name="geographicalCat" replicated="0">
<Scalar size="4" valueType="INT32"/>
<ScalarDefaultValue defaultValue="0"/>
</AttributeDescription>
<AttributeDescription attrType="STATIC" name="label" replicated="0">
<Scalar size="65" valueType="CHARN"/>
<ScalarDefaultValue defaultValue=""/>
</AttributeDescription>
<AttributeDescription attrType="STATIC" name="name" replicated="0">
<Scalar size="65" valueType="CHARN"/>
<ScalarDefaultValue defaultValue=""/>
</AttributeDescription>
<AttributeDescription attrType="STATIC" name="nom_instance" replicated="0">
<Scalar size="51" valueType="CHARN"/>
<ScalarDefaultValue defaultValue=""/>
</AttributeDescription>
<AttributeDescription attrType="STATIC" name="prevAlarmSynthesis" replicated="0">
<Vector numElements="4">
<Scalar size="4" valueType="INT32"/>
</Vector>
<VectorDefaultValue>
<ScalarDefaultValue defaultValue="0"/>
<ScalarDefaultValue defaultValue="0"/>
<ScalarDefaultValue defaultValue="0"/>
<ScalarDefaultValue defaultValue="0"/>
</VectorDefaultValue>
</AttributeDescription>
<AttributeDescription attrType="STATIC" name="type" replicated="0">
<Scalar size="21" valueType="CHARN"/>
<ScalarDefaultValue defaultValue=""/>
</AttributeDescription>
</Class>