<?xml version="1.0" encoding="ISO-8859-1"?><!DOCTYPE Class SYSTEM "dtd/dbkclass.dtd">
<Class name="ModeGroup" numAttributes="7" numInstances="0" numPeriod_MT="" numPeriod_ST="" period_MT="" period_ST="">
<AttributeDescription attrType="STATIC" name="UNIVNAME" replicated="0">
<Scalar size="65" valueType="CHARN"/>
<ScalarDefaultValue defaultValue=""/>
</AttributeDescription>
<AttributeDescription attrType="STATIC" name="computedDate" replicated="0">
<Scalar size="8" valueType="DATE"/>
<ScalarDefaultValue defaultValue="01/01/2000 00:00:00.000"/>
</AttributeDescription>
<AttributeDescription attrType="STATIC" name="computedStatus" replicated="0">
<Scalar size="4" valueType="INT32"/>
<ScalarDefaultValue defaultValue="0"/>
</AttributeDescription>
<AttributeDescription attrType="STATIC" name="computedValue" replicated="0">
<Scalar size="4" valueType="INT32"/>
<ScalarDefaultValue defaultValue="0"/>
</AttributeDescription>
<AttributeDescription attrType="STATIC" name="label" replicated="0">
<Scalar size="129" valueType="CHARN"/>
<ScalarDefaultValue defaultValue=""/>
</AttributeDescription>
<AttributeDescription attrType="STATIC" name="nom_instance" replicated="0">
<Scalar size="51" valueType="CHARN"/>
<ScalarDefaultValue defaultValue=""/>
</AttributeDescription>
<AttributeDescription attrType="STATIC" name="type" replicated="0">
<Scalar size="33" valueType="CHARN"/>
<ScalarDefaultValue defaultValue=""/>
</AttributeDescription>
</Class>